{
  "schema_version": "character_contract_v1",
  "contract_id": "character:hyuuga_hinata:default",
  "character_id": "hyuuga_hinata",
  "display_name": "hyuuga_hinata",
  "profile_version": "default",
  "franchise": [
    "naruto_(series)",
    "naruto_shippuuden"
  ],
  "identity": {
    "canonical_tag": "hyuuga_hinata",
    "must_preserve": [
      "hyuuga_hinata",
      "black_hair",
      "long_hair",
      "purple_eyes",
      "blunt_bangs",
      "byakugan",
      "sidelocks"
    ],
    "valid_variants": [],
    "conditional": [],
    "uncertain": []
  },
  "outfit": {
    "canonical_default": [
      "fishnets",
      "forehead_protector"
    ],
    "valid_variants": [],
    "conditional": [],
    "uncertain": []
  },
  "evidence": [
    {
      "source": "danbooru_taxonomy",
      "reference": "hyuuga_hinata",
      "supports": [
        "identity",
        "outfit"
      ]
    },
    {
      "source": "character_refs_manifest",
      "reference": "data/references/hyuuga_hinata/default/manifest.json",
      "supports": [
        "visual_reference"
      ]
    },
    {
      "source": "danbooru_taxonomy",
      "reference": "hyuuga_hinata",
      "supports": [
        "identity_taxonomy"
      ]
    }
  ],
  "source_profile": {
    "requested_character": "hyuuga_hinata",
    "requested_version": null,
    "matched_tag": "hyuuga_hinata",
    "canonical_name": "Hyuuga Hinata",
    "character_id": "hyuuga_hinata",
    "aliases": [
      "hyuuga_hinata",
      "Hyuuga Hinata",
      "hyuuga hinata"
    ],
    "character_profile_used": true,
    "gender": null,
    "copyright": [
      "naruto_(series)",
      "naruto_shippuuden"
    ],
    "characteristics": [
      "black_hair",
      "long_hair",
      "blunt_bangs",
      "large_breasts",
      "purple_eyes",
      "byakugan",
      "sidelocks"
    ],
    "clothing": [
      "jacket",
      "fishnets",
      "forehead_protector"
    ],
    "relationships": {},
    "version_match": null,
    "candidates": [],
    "source": "danbooru_taxonomy",
    "identity_resolution": {
      "requested_name": "hyuuga_hinata",
      "canonical_name": "Hyuuga Hinata",
      "canonical_tag": "hyuuga_hinata",
      "character_id": "hyuuga_hinata",
      "franchise": [
        "naruto_(series)",
        "naruto_shippuuden"
      ],
      "aliases": [
        "hyuuga_hinata",
        "Hyuuga Hinata",
        "hyuuga hinata"
      ],
      "characteristics": [
        "black_hair",
        "long_hair",
        "blunt_bangs",
        "large_breasts",
        "purple_eyes",
        "byakugan",
        "sidelocks"
      ],
      "clothing": [
        "jacket",
        "fishnets",
        "forehead_protector"
      ],
      "source": "danbooru_taxonomy"
    },
    "taxonomy_classification": {
      "IDENTITY": [
        "black_hair",
        "long_hair",
        "purple_eyes"
      ],
      "CANONICAL_APPEARANCE": [
        "blunt_bangs",
        "byakugan",
        "sidelocks"
      ],
      "CANONICAL_OUTFIT": [
        "fishnets",
        "forehead_protector"
      ],
      "ACCESSORY": [],
      "BODY_MORPHOLOGY": [
        "large_breasts"
      ],
      "CONTEXTUAL": [
        "jacket"
      ],
      "POSE_ACTION": [],
      "IGNORE": []
    },
    "taxonomy_evidence": [
      {
        "trait": "black_hair",
        "classification": "IDENTITY",
        "confidence": 0.98,
        "sources": [
          "danbooru_taxonomy"
        ]
      },
      {
        "trait": "long_hair",
        "classification": "IDENTITY",
        "confidence": 0.98,
        "sources": [
          "danbooru_taxonomy"
        ]
      },
      {
        "trait": "purple_eyes",
        "classification": "IDENTITY",
        "confidence": 0.98,
        "sources": [
          "danbooru_taxonomy"
        ]
      },
      {
        "trait": "blunt_bangs",
        "classification": "CANONICAL_APPEARANCE",
        "confidence": 0.98,
        "sources": [
          "danbooru_taxonomy"
        ]
      },
      {
        "trait": "byakugan",
        "classification": "CANONICAL_APPEARANCE",
        "confidence": 0.98,
        "sources": [
          "danbooru_taxonomy"
        ]
      },
      {
        "trait": "sidelocks",
        "classification": "CANONICAL_APPEARANCE",
        "confidence": 0.98,
        "sources": [
          "danbooru_taxonomy"
        ]
      },
      {
        "trait": "fishnets",
        "classification": "CANONICAL_OUTFIT",
        "confidence": 0.98,
        "sources": [
          "danbooru_taxonomy"
        ]
      },
      {
        "trait": "forehead_protector",
        "classification": "CANONICAL_OUTFIT",
        "confidence": 0.98,
        "sources": [
          "danbooru_taxonomy"
        ]
      },
      {
        "trait": "large_breasts",
        "classification": "BODY_MORPHOLOGY",
        "confidence": 0.98,
        "sources": [
          "danbooru_taxonomy"
        ]
      },
      {
        "trait": "jacket",
        "classification": "CONTEXTUAL",
        "confidence": 0.98,
        "sources": [
          "danbooru_taxonomy"
        ]
      }
    ]
  }
}
